[
  {"id":"PRJ-001","title":"Synthetic Community Water Point","state":"Aster","district":"Northfield","constituency_code":"AST-01","sanction_date":"2026-01-10","expected_completion_date":"2027-01-10","actual_completion_date":null,"sanctioned_amount":4200000,"utilized_amount":1260000,"physical_progress_percent":30,"status":"in_progress"},
  {"id":"PRJ-002","title":"Synthetic School Access Road","state":"Aster","district":"Northfield","constituency_code":"AST-01","sanction_date":"2025-01-15","expected_completion_date":"2026-01-15","actual_completion_date":null,"sanctioned_amount":7000000,"utilized_amount":6650000,"physical_progress_percent":58,"status":"delayed"},
  {"id":"PRJ-003","title":"Synthetic Primary Health Upgrade","state":"Aster","district":"Lakeside","constituency_code":"AST-02","sanction_date":"2026-04-01","expected_completion_date":"2027-04-01","actual_completion_date":null,"sanctioned_amount":5600000,"utilized_amount":600000,"physical_progress_percent":8,"status":"in_progress"},
  {"id":"PRJ-004","title":"Synthetic Solar Street Lighting","state":"Beryl","district":"Eastvale","constituency_code":"BER-01","sanction_date":"2025-08-12","expected_completion_date":"2026-08-12","actual_completion_date":"2026-07-25","sanctioned_amount":3100000,"utilized_amount":3020000,"physical_progress_percent":100,"status":"completed"},
  {"id":"PRJ-005","title":"Synthetic Market Drainage","state":"Beryl","district":"Eastvale","constituency_code":"BER-01","sanction_date":"2025-02-20","expected_completion_date":"2026-02-20","actual_completion_date":null,"sanctioned_amount":4800000,"utilized_amount":5100000,"physical_progress_percent":42,"status":"delayed"},
  {"id":"PRJ-006","title":"Synthetic Library Extension","state":"Beryl","district":"Riverbend","constituency_code":"BER-02","sanction_date":"2026-05-10","expected_completion_date":"2027-05-10","actual_completion_date":null,"sanctioned_amount":2200000,"utilized_amount":180000,"physical_progress_percent":12,"status":"in_progress"},
  {"id":"PRJ-007","title":"Synthetic Bus Shelter Network","state":"Cedar","district":"Hillview","constituency_code":"CED-01","sanction_date":"2025-10-01","expected_completion_date":"2026-10-01","actual_completion_date":null,"sanctioned_amount":3800000,"utilized_amount":3650000,"physical_progress_percent":92,"status":"in_progress"},
  {"id":"PRJ-008","title":"Synthetic Anganwadi Repair","state":"Cedar","district":"Hillview","constituency_code":"CED-01","sanction_date":"2025-03-05","expected_completion_date":"2026-03-05","actual_completion_date":"2026-04-16","sanctioned_amount":1800000,"utilized_amount":1780000,"physical_progress_percent":100,"status":"completed"},
  {"id":"PRJ-009","title":"Synthetic Sports Ground Renewal","state":"Cedar","district":"Meadow","constituency_code":"CED-02","sanction_date":"2026-02-14","expected_completion_date":"2027-02-14","actual_completion_date":null,"sanctioned_amount":6200000,"utilized_amount":5200000,"physical_progress_percent":21,"status":"in_progress"},
  {"id":"PRJ-010","title":"Synthetic Rainwater Harvesting","state":"Dune","district":"Sunridge","constituency_code":"DUN-01","sanction_date":"2025-09-10","expected_completion_date":"2026-09-10","actual_completion_date":null,"sanctioned_amount":2900000,"utilized_amount":2870000,"physical_progress_percent":96,"status":"in_progress"},
  {"id":"PRJ-011","title":"Synthetic Community Hall","state":"Dune","district":"Sunridge","constituency_code":"DUN-01","sanction_date":"2025-04-30","expected_completion_date":"2026-04-30","actual_completion_date":null,"sanctioned_amount":7500000,"utilized_amount":1500000,"physical_progress_percent":17,"status":"delayed"},
  {"id":"PRJ-012","title":"Synthetic Footbridge","state":"Dune","district":"Westmoor","constituency_code":"DUN-02","sanction_date":"2026-06-01","expected_completion_date":"2027-06-01","actual_completion_date":null,"sanctioned_amount":4400000,"utilized_amount":440000,"physical_progress_percent":10,"status":"in_progress"}
]
